,EMOTIONAL WELL-BEING  ,Not at all  ,A little bit  ,Some-what  ,Quite a bit  ,Very much  
GE1  ,I feel sad…………………………………  ,0  ,1  ,2  ,3  ,4  
GE2  ,I am satisfied with how I am coping with my illness…………………………………  ,0  ,1  ,2  ,3  ,4  
GE3  ,I am losing hope in the fight against my illness……………………………………..  ,0  ,1  ,2  ,3  ,4  
GE4  ,I feel nervous……………………………...  ,0  ,1  ,2  ,3  ,4  
GE5  ,I worry about dying……………………….  ,0  ,1  ,2  ,3  ,4  
GE6  ,I worry that my condition will get worse……………………………………...  ,0  ,1  ,2  ,3  ,4  
